idx,quechua,real
490,t'uku,Síncope. Paralización súbita del corazón
491,awki,Príncipe. Hijo de un ser superior o de un rey
492,siray,Coser. Unir mediante puntadas
493,qhuya runa,Minero. Persona que trabaja en minas
494,talliy,Echar líquido de un depósito a otro
495,k'aklla y,Desgajar. Separar la rama del tronco de donde nace. Partir el tronco con la azuela
496,wankar,Bombo. Tambor grande que se toca con una maza y se emplea en orquestas y bandas
497,jutk'uy,"Perforar. Horadar, agujerear"
498,atikllay,Advertir
499,sumaq,"Exquisito, -ta. De singular y extraordinaria calidad, belleza, gusto, sabor, etc"
